url_path,title,meta_description,canonical,h1
/404/,Page Not Found | Toronto Restaurant Growth,The page you,https://torontorestaurantgrowth.ca/404/,Page not found
/blog/catering-lead-seo-gta/,Catering Lead SEO for GTA Restaurants | Toronto Restaurant Growth,"Service-area pages, schema basics, and follow-up speed for B2B inquiries.",https://torontorestaurantgrowth.ca/blog/catering-lead-seo-gta/,Catering Lead SEO for GTA Restaurants
/blog/dine-toronto-seasonal-marketing/,Seasonal Promotions for Toronto Dining Rooms | Toronto Restaurant Growth,Calendar planning that respects staffing limits and margin reality.,https://torontorestaurantgrowth.ca/blog/dine-toronto-seasonal-marketing/,Seasonal Promotions for Toronto Dining Rooms
/blog/google-ads-local-campaign-restaurants/,Local Google Ads for Restaurants: When Paid Search Helps | Toronto Restaurant Growth,Pairing ads with organic Maps work without overpaying for branded clicks.,https://torontorestaurantgrowth.ca/blog/google-ads-local-campaign-restaurants/,Local Google Ads for Restaurants: When Paid Search Helps
/blog/halal-restaurant-marketing-gta/,"Halal Restaurant Marketing in the GTA: Respectful, Precise Positioning | Toronto Restaurant Growth",How to describe dietary standards clearly while staying competitive on Maps.,https://torontorestaurantgrowth.ca/blog/halal-restaurant-marketing-gta/,"Halal Restaurant Marketing in the GTA: Respectful, Precise Positioning"
/blog/,Blog | Toronto Restaurant Growth,"Restaurant marketing insights for Toronto and GTA independent restaurant owners. Google SEO, reviews, social media — practical advice that drives covers.",https://torontorestaurantgrowth.ca/blog/,From the Blog
/blog/instagram-reels-restaurant-promo-2026/,"Instagram Reels for Restaurants in 2026: Short Hooks, Real Kitchens | Toronto Restaurant Growth","What to film, how often to post, and how to connect clips to bookings.",https://torontorestaurantgrowth.ca/blog/instagram-reels-restaurant-promo-2026/,"Instagram Reels for Restaurants in 2026: Short Hooks, Real Kitchens"
/blog/neighbourhood-landing-pages-restaurants/,Neighbourhood Landing Pages That Actually Convert | Toronto Restaurant Growth,Avoid thin doorways; build useful local pages diners and Google both trust.,https://torontorestaurantgrowth.ca/blog/neighbourhood-landing-pages-restaurants/,Neighbourhood Landing Pages That Actually Convert
/blog/restaurant-email-marketing-list/,Email Lists Restaurants Will Actually Use | Toronto Restaurant Growth,"Consent-first capture, simple segments, and offers that do not train discount seekers.",https://torontorestaurantgrowth.ca/blog/restaurant-email-marketing-list/,Email Lists Restaurants Will Actually Use
/blog/restaurant-tiktok-growth-strategy/,TikTok Growth for Toronto Restaurants Without Cringe | Toronto Restaurant Growth,A grounded posting rhythm that supports reservations and brand trust.,https://torontorestaurantgrowth.ca/blog/restaurant-tiktok-growth-strategy/,TikTok Growth for Toronto Restaurants Without Cringe
/blog/toronto-restaurants-rank-google-maps/,How Toronto Restaurants Improve Google Maps Visibility | Toronto Restaurant Growth,"GBP hygiene, reviews, and on-site signals that compound over time.",https://torontorestaurantgrowth.ca/blog/toronto-restaurants-rank-google-maps/,How Toronto Restaurants Improve Google Maps Visibility
/blog/why-your-restaurant-not-showing-on-google/,Why Your Toronto Restaurant Is not Showing Up on Google | Toronto Restaurant Growth,Seven common visibility gaps and how to fix them without gimmicks.,https://torontorestaurantgrowth.ca/blog/why-your-restaurant-not-showing-on-google/,Why Your Toronto Restaurant Is not Showing Up on Google
/case-studies/crab-boil/,How TRG Helped Crab Boil Build 500M+ Impressions and Expand to Ottawa | Toronto Restaurant Growth,"From zero digital presence to 500M+ combined impressions, 113K TikTok followers, and a successful Ottawa expansion. See how Toronto Restaurant Growth runs marketing for one of Canada",https://torontorestaurantgrowth.ca/case-studies/crab-boil/,500 Million Impressions. One Restaurant Group. Zero Traditional Ad Spend.
/case-studies/,Restaurant Marketing Case Studies | Toronto Restaurant Growth,"Real results for real Toronto restaurants. See how TRG has grown restaurant brands through Google Maps SEO, social media, and review management.",https://torontorestaurantgrowth.ca/case-studies/,Real Numbers. Real Restaurants.
/contact/,Book a Free Google Audit — Toronto Restaurant Growth,"Get a free 15-minute review of your Google Business Profile, website, and reviews. We",https://torontorestaurantgrowth.ca/contact/,Your Free Google Audit — No Sales Pitch
/index/,Toronto Restaurant Growth | More Covers. Better Reviews. All From Google.,Toronto,https://torontorestaurantgrowth.ca/,More Covers. Better Reviews. All From Google.
/locations/etobicoke/,Restaurant Marketing in Etobicoke | Toronto Restaurant Growth,"Etobicoke restaurant marketing — we help independent restaurants along The Queensway, Bloor West, and Rexdale build their Google presence and fill tables with loyal local customers.",https://torontorestaurantgrowth.ca/locations/etobicoke/,Restaurant Marketing in Etobicoke
/locations/hamilton/,Restaurant Marketing in Hamilton | Toronto Restaurant Growth,Hamilton restaurant marketing for the city,https://torontorestaurantgrowth.ca/locations/hamilton/,Restaurant Marketing in Hamilton
/locations/,Restaurant Marketing GTA Locations | Toronto Restaurant Growth,"Toronto Restaurant Growth serves restaurants across the GTA — Scarborough, Brampton, Mississauga, North York, Etobicoke, Hamilton, Vaughan, and Markham.",https://torontorestaurantgrowth.ca/locations/,Hyperlocal Restaurant Marketing Across the GTA
/locations/markham/,Restaurant Marketing in Markham | Toronto Restaurant Growth,Markham restaurant marketing for the GTA,https://torontorestaurantgrowth.ca/locations/markham/,Restaurant Marketing in Markham
/locations/mississauga/,Restaurant Marketing in Mississauga | Toronto Restaurant Growth,"Mississauga restaurant marketing that gets you found on Google. We help restaurants along Hurontario, Dixie, and Streetsville grow their visibility and fill tables.",https://torontorestaurantgrowth.ca/locations/mississauga/,Restaurant Marketing in Mississauga
/locations/north-york/,Restaurant Marketing in North York | Toronto Restaurant Growth,"North York restaurant marketing — Yonge Street corridor, Finch Ave food district, and Korean Village. We help North York restaurants rank on Google and fill tables.",https://torontorestaurantgrowth.ca/locations/north-york/,Restaurant Marketing in North York
/locations/restaurant-marketing-brampton/,Restaurant Marketing in Brampton | Toronto Restaurant Growth,"Brampton restaurant marketing for South Asian, halal, and fast-growing suburb restaurants. We help Brampton",https://torontorestaurantgrowth.ca/locations/restaurant-marketing-brampton/,Restaurant Marketing in Brampton
/locations/restaurant-marketing-scarborough/,Restaurant Marketing in Scarborough | Toronto Restaurant Growth,"Scarborough restaurant marketing that drives real results. We help Tamil, Caribbean, Bangladeshi, and global cuisine restaurants get found on Google and packed with local diners.",https://torontorestaurantgrowth.ca/locations/restaurant-marketing-scarborough/,Restaurant Marketing in Scarborough
/locations/vaughan/,Restaurant Marketing in Vaughan | Toronto Restaurant Growth,"Vaughan restaurant marketing — upscale dining, Italian corridor, and Middle Eastern cuisine in one of Ontario",https://torontorestaurantgrowth.ca/locations/vaughan/,Restaurant Marketing in Vaughan
/niche/halal-restaurant-marketing-toronto/,Halal Restaurant Marketing Toronto | The GTA's Only Specialist | Toronto Restaurant Growth,"Halal restaurant marketing in Toronto, Brampton, Scarborough, and Mississauga. Halal directory submissions, Google Maps optimization, Ramadan campaigns, and halal-community social media. The GTA",https://torontorestaurantgrowth.ca/niche/halal-restaurant-marketing-toronto/,Halal Restaurant Marketing in Toronto — The GTA&#39;s Only Specialist
/pricing/,"Pricing — Simple, Transparent Restaurant Marketing | Toronto Restaurant Growth","No hidden fees. No long contracts. One plan: Growth at $997/mo plus $4,997 setup. Social and video available as a separate add-on.",https://torontorestaurantgrowth.ca/pricing/,"Simple, Transparent Pricing"
/privacy/,Privacy Policy — Toronto Restaurant Growth,"How Toronto Restaurant Growth collects, uses, and protects personal information when you use our website or book a consultation.",https://torontorestaurantgrowth.ca/privacy/,Privacy Policy
/services/google-maps-seo/,Google Maps SEO for Restaurants Toronto | Toronto Restaurant Growth,"Google Maps SEO for Toronto and GTA restaurants. Rank in the top 3 for your cuisine and neighbourhood. More searches, more calls, more covers — without ad spend.",https://torontorestaurantgrowth.ca/services/google-maps-seo/,Google Maps SEO for Restaurants Toronto
/services/grand-opening-marketing/,Restaurant Grand Opening Marketing Toronto | Toronto Restaurant Growth,Grand opening marketing for Toronto and GTA restaurants. Launch with a lineup out the door — from pre-opening buzz to packed opening week. TRG runs the full digital campaign.,https://torontorestaurantgrowth.ca/services/grand-opening-marketing/,Restaurant Grand Opening Marketing Toronto
/services/,Restaurant Marketing Services Toronto | Toronto Restaurant Growth,"Five services built exclusively for Toronto and GTA restaurants: website design, social media, Google Maps SEO, review management, and grand opening marketing.",https://torontorestaurantgrowth.ca/services/,Everything Your Restaurant Needs to Win on Google
/services/restaurant-review-management/,Restaurant Review Management Toronto | Toronto Restaurant Growth,"Restaurant review management in Toronto. Get more 5-star reviews, respond to every review professionally, and turn your reputation into your best marketing channel. The GTA",https://torontorestaurantgrowth.ca/services/restaurant-review-management/,Restaurant Review Management Toronto
/services/restaurant-website-design/,Restaurant Website Design Toronto | Toronto Restaurant Growth,"Restaurant website design in Toronto that drives reservations. Fast, mobile-first websites built specifically for GTA restaurants — not one-size-fits-all templates.",https://torontorestaurantgrowth.ca/services/restaurant-website-design/,Restaurant Website Design Toronto
/services/social-media-management/,Restaurant Social Media Management Toronto | Toronto Restaurant Growth,"Social and video content add-on for Toronto restaurants — $3,000/month through Jayden Aj. TikTok, Reels, and on-site production. Not included in core TRG plans.",https://torontorestaurantgrowth.ca/services/social-media-management/,Restaurant Social Media Management Toronto
/terms/,Terms of Use — Toronto Restaurant Growth,Terms governing use of the Toronto Restaurant Growth website and marketing consultations.,https://torontorestaurantgrowth.ca/terms/,Terms of Use
